{
  "artifact_type": "hyperray_model",
  "schema_version": 2,
  "artifact_id": "model.symbolic.fixture",
  "model_id": "model.symbolic",
  "boundary_artifact": { "artifact_id": "boundary", "artifact_type": "hyperray_boundary", "schema_version": 1, "sha256": "0000000000000000000000000000000000000000000000000000000000000000" },
  "executable_image": { "artifact_id": "image", "artifact_type": "executable_image", "schema_version": 1, "sha256": "0000000000000000000000000000000000000000000000000000000000000000" },
  "semantics": {
    "target_instruction": { "artifact_id": "semantics.target", "artifact_type": "semantic_spec", "schema_version": 1, "sha256": "0000000000000000000000000000000000000000000000000000000000000000" },
    "memory_model": { "artifact_id": "semantics.memory", "artifact_type": "semantic_spec", "schema_version": 1, "sha256": "0000000000000000000000000000000000000000000000000000000000000000" },
    "runtime": { "artifact_id": "semantics.runtime", "artifact_type": "semantic_spec", "schema_version": 1, "sha256": "0000000000000000000000000000000000000000000000000000000000000000" },
    "scheduler": { "artifact_id": "semantics.scheduler", "artifact_type": "semantic_spec", "schema_version": 1, "sha256": "0000000000000000000000000000000000000000000000000000000000000000" },
    "environment": { "artifact_id": "semantics.environment", "artifact_type": "semantic_spec", "schema_version": 1, "sha256": "0000000000000000000000000000000000000000000000000000000000000000" }
  },
  "requirement_artifacts": [
    { "artifact_id": "requirement.safety", "artifact_type": "hyperray_requirement", "schema_version": 2, "sha256": "0000000000000000000000000000000000000000000000000000000000000000" }
  ],
  "encoding": {
    "kind": "sequential_circuit",
    "encoding_version": 2,
    "state_bits": 2,
    "choice_bits": 1,
    "state_layout": [
      { "component_id": "pc", "component_class": "machine_control", "first_bit": 0, "bit_count": 1, "finite_domain_id": "pc.domain" },
      { "component_id": "monitor", "component_class": "requirement_monitor", "first_bit": 1, "bit_count": 1, "finite_domain_id": "monitor.domain" }
    ],
    "choice_layout": [
      { "component_id": "choice", "component_class": "choice", "first_bit": 0, "bit_count": 1, "finite_domain_id": "choice.domain" }
    ],
    "network": {
      "format": "btor2",
      "format_version": "BTOR2-CAV18",
      "artifact": { "artifact_id": "model.network.btor2", "artifact_type": "model_ir", "schema_version": 1, "sha256": "0000000000000000000000000000000000000000000000000000000000000000" },
      "entry_symbol": "model.main",
      "interface_sha256": "0000000000000000000000000000000000000000000000000000000000000000"
    },
    "ports": [
      { "port_id": "p.state", "direction": "input", "role": "current_state", "bit_width": 2, "canonical_index": 0 },
      { "port_id": "p.choice", "direction": "input", "role": "nondeterministic_choice", "bit_width": 1, "canonical_index": 1 },
      { "port_id": "p.next", "direction": "output", "role": "next_state", "bit_width": 2, "canonical_index": 2 },
      { "port_id": "p.initial", "direction": "output", "role": "initial_predicate", "bit_width": 1, "canonical_index": 3 },
      { "port_id": "p.choice_valid", "direction": "output", "role": "choice_valid_predicate", "bit_width": 1, "canonical_index": 4 },
      { "port_id": "p.enabled", "direction": "output", "role": "step_enabled_predicate", "bit_width": 1, "canonical_index": 5 },
      { "port_id": "p.effect.machine", "direction": "output", "role": "effect_predicate", "bit_width": 1, "canonical_index": 6 },
      { "port_id": "p.terminal.normal", "direction": "output", "role": "terminal_predicate", "bit_width": 1, "canonical_index": 7 },
      { "port_id": "p.terminal.deadlock", "direction": "output", "role": "terminal_predicate", "bit_width": 1, "canonical_index": 8 },
      { "port_id": "p.terminal.trap", "direction": "output", "role": "terminal_predicate", "bit_width": 1, "canonical_index": 9 },
      { "port_id": "p.terminal.abort", "direction": "output", "role": "terminal_predicate", "bit_width": 1, "canonical_index": 10 },
      { "port_id": "p.terminal.ub", "direction": "output", "role": "terminal_predicate", "bit_width": 1, "canonical_index": 11 },
      { "port_id": "p.terminal.capacity", "direction": "output", "role": "terminal_predicate", "bit_width": 1, "canonical_index": 12 },
      { "port_id": "p.root.main", "direction": "output", "role": "root_predicate", "bit_width": 1, "canonical_index": 13 },
      { "port_id": "p.obs.present", "direction": "output", "role": "observation_present", "bit_width": 1, "canonical_index": 14 },
      { "port_id": "p.obs.payload", "direction": "output", "role": "observation_payload", "bit_width": 8, "canonical_index": 15 },
      { "port_id": "p.req.state", "direction": "output", "role": "requirement_state_label", "bit_width": 1, "canonical_index": 16 },
      { "port_id": "p.acceptance", "direction": "output", "role": "acceptance_predicate", "bit_width": 1, "canonical_index": 17 },
      { "port_id": "p.fairness", "direction": "output", "role": "fairness_predicate", "bit_width": 1, "canonical_index": 18 }
    ],
    "bindings": {
      "current_state_port_id": "p.state",
      "choice_port_id": "p.choice",
      "next_state_port_id": "p.next",
      "initial_predicate_port_id": "p.initial",
      "choice_valid_predicate_port_id": "p.choice_valid",
      "step_enabled_predicate_port_id": "p.enabled",
      "terminal_ports": {
        "normal_termination": "p.terminal.normal",
        "nonterminal_deadlock": "p.terminal.deadlock",
        "trap": "p.terminal.trap",
        "abort": "p.terminal.abort",
        "undefined_behavior": "p.terminal.ub",
        "capacity_error": "p.terminal.capacity"
      },
      "effects": [
        {
          "kind": "machine_step_effect",
          "effect_id": "effect.add",
          "guard_port_id": "p.effect.machine",
          "enabled_port_id": "p.enabled",
          "next_state_port_id": "p.next",
          "image_instruction_ids": ["instruction.0"],
          "semantic_case_ids": ["semantics.add.base"],
          "observation_port_ids": ["p.obs.present", "p.obs.payload"],
          "proof_obligation_id": "obligation.effect.add"
        }
      ],
      "roots": [{ "root_id": "root.main", "root_kind": "program_root", "predicate_port_id": "p.root.main" }],
      "query_roots": [{ "query_id": "query.safety", "requirement_id": "requirement.safety", "selected_root_ids": ["root.main"] }],
      "observations": [{ "symbol_id": "observation.return", "present_port_id": "p.obs.present", "payload_port_ids": ["p.obs.payload"] }],
      "requirements": [{ "requirement_id": "requirement.safety", "state_label_port_ids": ["p.req.state"], "step_label_port_ids": [], "acceptance_port_ids": ["p.acceptance"], "fairness_port_ids": ["p.fairness"] }]
    },
    "validated_lowering_certificate": { "artifact_id": "certificate.lowering", "artifact_type": "hyperray_validated_certificate", "schema_version": 2, "certificate_kind": "circuit_lowering_equivalence", "sha256": "0000000000000000000000000000000000000000000000000000000000000000" }
  }
}
